{"$schema":"./challenger-first-episode-receipt-v1.schema.json","contract":{"contract_hash":"6b02a7b9e636420983b1fd47b6264962daaebdaaee66ef8e42d263bd0493d138","contract_id":"challenger_launchd_contract_101a0a0aca340df5c7de9a84e62a88c76ccf370ded93aeebf8d3ebcdb169efa9","contract_trust_hash":"9e592203c27ffb8e4d6884c1f45bf892c60f7ee92afa7285e9cdcdbb29dea92b","launchd_plist_sha256":"f6b2283ad4c01ee6e7dc8e954bdcb29dd221d5b79d4a04b69618af1d26182b53"},"eligibility":{"external_time_anchor":"INELIGIBLE_LOCAL_ONLY","forward_evidence":"LOCAL_PREQUENTIAL_RESEARCH_ONLY","paper":"INELIGIBLE_SINGLE_EPISODE","profitability":"INELIGIBLE","release_oos":"INELIGIBLE_FORWARD_COLLECTION_ONLY"},"episode":{"entry_scheduled_for":"2026-07-29T00:00:00.000Z","episode_id":"challenger_episode_45c86b2c0c1610d890c2d956915803c4b375b2838a66215f3f87311c8342be91","exit_action":"EXIT_LONG_SMA20","exit_scheduled_for":"2026-07-29T16:00:00.000Z","minimum_hold_until":"2026-07-29T08:00:00.000Z","vertical_exit_at":"2026-07-30T00:00:00.000Z"},"forward_start":"2026-07-29T00:00:00.000Z","install_receipt":{"execution_snapshot":{"file_count":82,"repository_root":"/Users/chenm4/Library/Application Support/CryptoQuant/challenger-forward-v1/deployment/b96955a","total_bytes":1687320,"tree_hash":"10695e7ab2cf1fe2a284cfd2429dcd512b72b3d76cc03c09c27543a062f2e11c"},"receipt_hash":"e160a7f4603e45751e2618b9132adf5050e88c382e08a135f789a115de93b65c","receipt_id":"challenger_launchd_install_receipt_d9f8b99b5aeef80bd7627fda751d856ce64b1e68bd016cf538dfe707b154260e","target_path":"/Users/chenm4/Library/LaunchAgents/local.crypto-quant.challenger-forward.plist","target_sha256":"f6b2283ad4c01ee6e7dc8e954bdcb29dd221d5b79d4a04b69618af1d26182b53"},"launchctl_print":{"argv":["/bin/launchctl","print","gui/501/local.crypto-quant.challenger-forward"],"command_evidence_hash":"82d960ee4faacd100a7edb9bc4068f4bda48b9248d5a22393495e976daac6e02","return_code":0,"stderr_sha256":"e3b0c44298fc1c149afbf4c8996fb92427ae41e4649b934ca495991b7852b855","stderr_size_bytes":0,"stderr_utf8":"","stdout_sha256":"27fe676e93caadba8e98379b019ad64b17589e60cdd1a457a0cbac693bce531c","stdout_size_bytes":3797,"stdout_utf8":"gui/501/local.crypto-quant.challenger-forward = {\n\tactive count = 0\n\tpath = /Users/chenm4/Library/LaunchAgents/local.crypto-quant.challenger-forward.plist\n\ttype = LaunchAgent\n\tstate = not running\n\n\tprogram = /Library/Developer/CommandLineTools/Library/Frameworks/Python3.framework/Versions/3.9/bin/python3.9\n\targuments = {\n\t\t/Library/Developer/CommandLineTools/Library/Frameworks/Python3.framework/Versions/3.9/bin/python3.9\n\t\t-m\n\t\tcrypto_quant.challenger_forward_runner_cli\n\t\t--state-path\n\t\t/Users/chenm4/Library/Application Support/CryptoQuant/challenger-forward-v1/state/challenger-forward.sqlite\n\t\t--output-root\n\t\t/Users/chenm4/Library/Application Support/CryptoQuant/challenger-forward-v1/artifacts\n\t}\n\n\tworking directory = /Users/chenm4/Library/Application Support/CryptoQuant/challenger-forward-v1/deployment/b96955a\n\n\tstdout path = /Users/chenm4/Library/Application Support/CryptoQuant/challenger-forward-v1/log/challenger-forward.stdout.log\n\tstderr path = /Users/chenm4/Library/Application Support/CryptoQuant/challenger-forward-v1/log/challenger-forward.stderr.log\n\tinherited environment = {\n\t\tSSH_AUTH_SOCK => /private/tmp/com.apple.launchd.fUfeo8L3Z2/Listeners\n\t}\n\n\tdefault environment = {\n\t\tPATH => /usr/bin:/bin:/usr/sbin:/sbin\n\t}\n\n\tenvironment = {\n\t\tPYTHONPATH => /Users/chenm4/Library/Application Support/CryptoQuant/challenger-forward-v1/deployment/b96955a/src\n\t\tXPC_SERVICE_NAME => local.crypto-quant.challenger-forward\n\t}\n\n\tdomain = gui/501 [100003]\n\tumask = 77\n\tasid = 100003\n\tminimum runtime = 60\n\texit timeout = 5\n\truns = 12\n\tlast exit code = 0\n\n\tevent triggers = {\n\t\tlocal.crypto-quant.challenger-forward.268435477 => {\n\t\t\tkeepalive = 0\n\t\t\tservice = local.crypto-quant.challenger-forward\n\t\t\tstream = com.apple.launchd.calendarinterval\n\t\t\tmonitor = com.apple.UserEventAgent-Aqua\n\t\t\tdescriptor = {\n\t\t\t\t\"Minute\" => 2\n\t\t\t\t\"Hour\" => 4\n\t\t\t}\n\t\t}\n\t\tlocal.crypto-quant.challenger-forward.268435476 => {\n\t\t\tkeepalive = 0\n\t\t\tservice = local.crypto-quant.challenger-forward\n\t\t\tstream = com.apple.launchd.calendarinterval\n\t\t\tmonitor = com.apple.UserEventAgent-Aqua\n\t\t\tdescriptor = {\n\t\t\t\t\"Minute\" => 2\n\t\t\t\t\"Hour\" => 0\n\t\t\t}\n\t\t}\n\t\tlocal.crypto-quant.challenger-forward.268435481 => {\n\t\t\tkeepalive = 0\n\t\t\tservice = local.crypto-quant.challenger-forward\n\t\t\tstream = com.apple.launchd.calendarinterval\n\t\t\tmonitor = com.apple.UserEventAgent-Aqua\n\t\t\tdescriptor = {\n\t\t\t\t\"Minute\" => 2\n\t\t\t\t\"Hour\" => 20\n\t\t\t}\n\t\t}\n\t\tlocal.crypto-quant.challenger-forward.268435480 => {\n\t\t\tkeepalive = 0\n\t\t\tservice = local.crypto-quant.challenger-forward\n\t\t\tstream = com.apple.launchd.calendarinterval\n\t\t\tmonitor = com.apple.UserEventAgent-Aqua\n\t\t\tdescriptor = {\n\t\t\t\t\"Minute\" => 2\n\t\t\t\t\"Hour\" => 16\n\t\t\t}\n\t\t}\n\t\tlocal.crypto-quant.challenger-forward.268435479 => {\n\t\t\tkeepalive = 0\n\t\t\tservice = local.crypto-quant.challenger-forward\n\t\t\tstream = com.apple.launchd.calendarinterval\n\t\t\tmonitor = com.apple.UserEventAgent-Aqua\n\t\t\tdescriptor = {\n\t\t\t\t\"Minute\" => 2\n\t\t\t\t\"Hour\" => 12\n\t\t\t}\n\t\t}\n\t\tlocal.crypto-quant.challenger-forward.268435478 => {\n\t\t\tkeepalive = 0\n\t\t\tservice = local.crypto-quant.challenger-forward\n\t\t\tstream = com.apple.launchd.calendarinterval\n\t\t\tmonitor = com.apple.UserEventAgent-Aqua\n\t\t\tdescriptor = {\n\t\t\t\t\"Minute\" => 2\n\t\t\t\t\"Hour\" => 8\n\t\t\t}\n\t\t}\n\t}\n\n\tevent channels = {\n\t\t\"com.apple.launchd.calendarinterval\" = {\n\t\t\tport = 0xd5997\n\t\t\tactive = 0\n\t\t\tmanaged = 1\n\t\t\treset = 0\n\t\t\thide = 0\n\t\t\twatching = 1\n\t\t}\n\t}\n\n\tspawn type = background (5)\n\tjetsam priority = 40\n\tjetsam memory limit (active) = (unlimited)\n\tjetsam memory limit (inactive) = (unlimited)\n\tjetsamproperties category = daemon\n\tjetsam thread limit = 32\n\tcpumon = default\n\tprobabilistic guard malloc policy = {\n\t\tactivation rate = 1/1000\n\t\tsample rate = 1/0\n\t}\n\n\tproperties = runatload | low priority i/o | abandon process group | inferred program\n}\n"},"launchd_runs_observed":12,"logs":{"stderr":{"empty":true,"observed_prefix_stat":{"device":16777230,"inode":13229931,"link_count":1,"mode_octal":"0600","owner_uid":501,"sha256":"e3b0c44298fc1c149afbf4c8996fb92427ae41e4649b934ca495991b7852b855","size_bytes":0},"path":"/Users/chenm4/Library/Application Support/CryptoQuant/challenger-forward-v1/log/challenger-forward.stderr.log"},"stdout":{"matched_records":[{"line_number":6,"record":{"broker_request_count":0,"current_slot":"2026-07-29T00:00:00.000Z","decision_count":1,"decision_hash":"c7ee6bfac0ac1da6986a9eb5089cc6cc8e2de520937935edbb8df45731b34ac7","decision_id":"challenger_decision_7108b0226b32c858217ce3668d69b8cbb3efea614091a632f1c709afb80b4106","forward_evidence_eligibility":"UNANCHORED_LOCAL_PREQUENTIAL_ONLY","kline_request_count":1,"next_required_slot":"2026-07-29T04:00:00.000Z","order_submission_count":0,"server_time_request_count":3,"source_bundle_hash":"43c7f55aefca8ccea6f204747b8e10d474cd31368c1dbf548c310b6ea16d28bf","source_bundle_path":"/Users/chenm4/Library/Application Support/CryptoQuant/challenger-forward-v1/artifacts/challenger-forward/source-bundles/challenger_forward_source_bundle_23abb318af92e153a7b4415dc1814b374e3a89e78b906d3a96b02ede84c91862.json","status":"RECORDED"},"record_hash":"a5ee75c2878e0cddd01c1141712ab36481e242ff352d4a2c0b0a66933cdcfe5d","sequence":1},{"line_number":7,"record":{"broker_request_count":0,"current_slot":"2026-07-29T04:00:00.000Z","decision_count":2,"decision_hash":"9844527674dff58bd64d3d057e9d077aae22a2106d73d89132a579be7828a117","decision_id":"challenger_decision_d0c2a2c6c4ba9ab7e02f114b5b6404d47ccfe51b35387a18112977a14f7e055a","forward_evidence_eligibility":"UNANCHORED_LOCAL_PREQUENTIAL_ONLY","kline_request_count":1,"next_required_slot":"2026-07-29T08:00:00.000Z","order_submission_count":0,"server_time_request_count":3,"source_bundle_hash":"05ed5038a48ed0b17e76cebef56daef0e41739e2c233eca366d75cea5cb4fcf1","source_bundle_path":"/Users/chenm4/Library/Application Support/CryptoQuant/challenger-forward-v1/artifacts/challenger-forward/source-bundles/challenger_forward_source_bundle_8427dc36b96f25748c07b64f2f92d0f1e965b26846215d1804b999a0deaf4587.json","status":"RECORDED"},"record_hash":"c7c3da7156dda27e2a610179116251040f6f2a0b49b2940c41259c42ac58217c","sequence":2},{"line_number":8,"record":{"broker_request_count":0,"current_slot":"2026-07-29T08:00:00.000Z","decision_count":3,"decision_hash":"8d7b04e1f011a3268f6712568f3af404c79ad75f42c531381254d1951c1888e9","decision_id":"challenger_decision_7b9ce7046ac1dc61ae56457d936c02b1233df1ceef45b0c91106ecda61a20000","forward_evidence_eligibility":"UNANCHORED_LOCAL_PREQUENTIAL_ONLY","kline_request_count":1,"next_required_slot":"2026-07-29T12:00:00.000Z","order_submission_count":0,"server_time_request_count":3,"source_bundle_hash":"0f5eee61084ad63f877163449c26a65872609fb705893f9c85990528c7c03f7f","source_bundle_path":"/Users/chenm4/Library/Application Support/CryptoQuant/challenger-forward-v1/artifacts/challenger-forward/source-bundles/challenger_forward_source_bundle_c05e2a7460d68afb953e7618edae751a329ff8d4d715e12504af04df19675174.json","status":"RECORDED"},"record_hash":"08af0d35376a0411f702c7cef29382eb0fb13515381bac6e3684a632de281fc9","sequence":3},{"line_number":9,"record":{"broker_request_count":0,"current_slot":"2026-07-29T12:00:00.000Z","decision_count":4,"decision_hash":"3512c08166013b47f6c061e724e83c9562b3321b2f43e1a4c8e1079064248d8a","decision_id":"challenger_decision_1151f1898cad9e75dcf943d901f2f85f29877469b65d47ea885483a83491957f","forward_evidence_eligibility":"UNANCHORED_LOCAL_PREQUENTIAL_ONLY","kline_request_cou